,Title,Article id,Publication Date,Authors,Affliations,One Sentence Summary,Abstract
16,Adding chiropractic manipulative therapy to standard medical care for patients with acute low back pain: results of a pragmatic randomized comparative effectiveness study.,23060056,2012-10-13,"['Christine M Goertz', 'Cynthia R Long', 'Maria A Hondras', 'Richard Petri', 'Roxana Delgado', 'Dana J Lawrence', 'Edward F Owens', 'William C Meeker']","['Palmer Center for Chiropractic Research, Davenport, IA 52803, USA. christine.goertz@palmer.edu', 'UNKNOWN', 'UNKNOWN', 'UNKNOWN', 'UNKNOWN', 'UNKNOWN', 'UNKNOWN', 'UNKNOWN']",The study found that adding chiropractic manipulative therapy to standard medical care significantly improved pain and physical function in young adults with acute low back pain.,"Randomized controlled trial.
To assess changes in pain levels and physical functioning in response to standard medical care (SMC) versus SMC plus chiropractic manipulative therapy (CMT) for the treatment of low back pain (LBP) among 18 to 35-year-old active-duty military personnel.
LBP is common, costly, and a significant cause of long-term sick leave and work loss. Many different interventions are available, but there exists no consensus on the best approach. One intervention often used is manipulative therapy. Current evidence from randomized controlled trials demonstrates that manipulative therapy may be as effective as other conservative treatments of LBP, but its appropriate role in the healthcare delivery system has not been established.
Prospective, 2-arm randomized controlled trial pilot study comparing SMC plus CMT with only SMC. The primary outcome measures were changes in back-related pain on the numerical rating scale and physical functioning at 4 weeks on the Roland-Morris Disability Questionnaire and back pain functional scale (BPFS).
Mean Roland-Morris Disability Questionnaire scores decreased in both groups during the course of the study, but adjusted mean scores were significantly better in the SMC plus CMT group than in the SMC group at both week 2 (P < 0.001) and week 4 (P = 0.004). Mean numerical rating scale pain scores were also significantly better in the group that received CMT. Adjusted mean back pain functional scale scores were significantly higher (improved) in the SMC plus CMT group than in the SMC group at both week 2 (P < 0.001) and week 4 (P = 0.004).
The results of this trial suggest that CMT in conjunction with SMC offers a significant advantage for decreasing pain and improving physical functioning when compared with only standard care, for men and women between 18 and 35 years of age with acute LBP."
17,Cost-effectiveness of medical and chiropractic care for acute and chronic low back pain.,16226622,2005-10-18,"['Mitchell Haas', 'Rajiv Sharma', 'Miron Stano']","['Center for Outcomes Studies, Western States Chiropractic College, Portland, OR 97230, USA. mhaas@wschiro.edu', 'UNKNOWN', 'UNKNOWN']","Chiropractic care is a relatively cost-effective treatment option for chronic low back pain, and is at least as good as other therapeusis for acute low back pain.","To identify relative provider costs, clinical outcomes, and patient satisfaction for the treatment of low back pain (LBP).
This was a practice-based, nonrandomized, comparative study of patients self-referring to 60 doctors of chiropractic and 111 medical doctors in 51 chiropractic and 14 general practice community clinics over a 2-year period. Patients were included if they were at least 18 years old, ambulatory, and had low back pain of mechanical origin (n = 2780). Outcomes were (standardized) office costs, office costs plus referral costs for office-based care and advanced imaging, pain, functional disability, patient satisfaction, physical health, and mental health evaluated at 3 and 12 months after the start of care. Multiple regression analysis was used to correct for baseline differences between provider types.
Chiropractic office costs were higher for both acute and chronic patients (P < .01). When referrals were included, there were no significant differences in either group between provider types (P > .20). Acute and chronic chiropractic patients experienced better outcomes in pain, functional disability, and patient satisfaction (P < .01); clinically important differences in pain and disability improvement were found for chronic patients only.
Chiropractic care appeared relatively cost-effective for the treatment of chronic LBP. Chiropractic and medical care performed comparably for acute patients. Practice-based clinical outcomes were consistent with systematic reviews of spinal manipulation efficacy: manipulation-based therapy is at least as good as and, in some cases, better than other therapeusis. This evidence can guide physicians, payers, and policy makers in evaluating chiropractic as a treatment option for low back pain."
18,The short-term effectiveness of balance taping on acute nonspecific low-back pain: A case report.,29390497,2018-02-03,['Jung-Hoon Lee'],"['Department of Physical Therapy, College of Nursing and Healthcare Sciences and Human Ecology, Dong-Eui University, Eomgwangno, Busanjin-gu, Busan, Republic of Korea.']",The use of kinesiology tape can help to reduce pain and improve function in patients with acute nonspecific low back pain.,"Low back pain has a significant socioeconomic impact. Repetitive lifting, with combined twisting and flexion motions of the lumbar spine, increases the risk for low-back pain and injury to the supporting tissues.
A 60-year-old male who presented with acute low-back pain, with a pain intensity of 6/10 on the visual analog scale (VAS) and an Oswestry disability index (ODI) score of 70%. The range of motion (ROM) of the lumbar spine on initial examination, relative to the normal peak ROM, was as follows: extension, 12°/30°; flexion, 15°/80°; left rotation, 15°/45°; and right rotation, 25°/45°.
He was diagnosed as acute nonspecific low-back pain sustained with repetitive lifting, combining motions of flexion and twisting.
The balance taping was applied for 16 h/day, on average, for 3 consecutive days was used as the primary treatment to manage the patient's low-back pain.
The application of balance taping increased the range of motion of the lumbar spine as follows: flexion, from 15° to 77°; extension, from 12° to 27°; right rotation, from 25° to 45°; and left rotation, from 15° to 45°. The ODI score decreased from 70% to 0%, and the VAS score from 6/10 to 0.
We propose that balance taping using kinesiology tape could serve as a complementary approach to other treatments for the treatment of acute nonspecific low-back pain."
